{
  "artifacts": [
    {
      "byte_length": 411,
      "media_type": "application/json",
      "path": "assurance/capital.json",
      "sha256": "sha256:d19fdcc6105f7aa38fb711de25afb283db1ce9601f3a6b24b739eb599345076b"
    },
    {
      "byte_length": 573,
      "media_type": "application/json",
      "path": "execution/model.json",
      "sha256": "sha256:e677c5a4e990be17feafd24d2d55e2bf0a963187ada1bde6aa7eb19180a453b4"
    },
    {
      "byte_length": 7,
      "media_type": "application/octet-stream",
      "path": "execution/output.bin",
      "sha256": "sha256:d5bff25f1372e12f9d306aa5aaa94136469c1bc5178641cd52baa9cc2e60bdc7"
    },
    {
      "byte_length": 850,
      "media_type": "application/json",
      "path": "execution/report.json",
      "sha256": "sha256:3b5cff54e1e4107583d91f1dd3c025fc6495145062954d3e77857c2bbf462831"
    },
    {
      "byte_length": 3347,
      "media_type": "application/json",
      "path": "receipts/01-order.json",
      "sha256": "sha256:e27c6975ab54e4317a941fd358c93725db3adcfc12ecfa77c9ed1e8006d7c5c7"
    },
    {
      "byte_length": 3438,
      "media_type": "application/json",
      "path": "receipts/02-route.json",
      "sha256": "sha256:2c7a9aa798ae1d0cd09c8f5936422f8534bb5d5677141788157121254fa971e4"
    },
    {
      "byte_length": 3662,
      "media_type": "application/json",
      "path": "receipts/03-accept.json",
      "sha256": "sha256:69d4cad247bdf404df7d3f8f0c6ae6c52a04f5543e79da8c8ac8d1148defc037"
    },
    {
      "byte_length": 3597,
      "media_type": "application/json",
      "path": "receipts/04-delivery.json",
      "sha256": "sha256:4f930110855979791e0d41ccb762a95cfa7f2c01c10fabf182907f70653f6632"
    },
    {
      "byte_length": 3523,
      "media_type": "application/json",
      "path": "receipts/05-capital-bind.json",
      "sha256": "sha256:b47e47e52f7aa5f0dacc7ffc8fa5c0389e85dc06c14b6c5a00aafe0e56bd7dfd"
    },
    {
      "byte_length": 3631,
      "media_type": "application/json",
      "path": "receipts/06-coverage-checkpoint.json",
      "sha256": "sha256:7d2930d7c4b872637ae32c42a675da42f54016b6bd0b2b5afc325b8b43b55670"
    },
    {
      "byte_length": 4069,
      "media_type": "application/json",
      "path": "receipts/07-rely.json",
      "sha256": "sha256:ef15549d41e16c9e9822ea4b7c17c230eceaca870e51005a26fd01294217f4dc"
    },
    {
      "byte_length": 336,
      "media_type": "application/json",
      "path": "receiver/coverage.json",
      "sha256": "sha256:e70852b798d791dfada50741c0203a270c2bf3594e3fa8a7a2e207cb3c786265"
    },
    {
      "byte_length": 200,
      "media_type": "application/json",
      "path": "settlement/rail-evidence.json",
      "sha256": "sha256:4514906b1dae0d5b64d233dcb9b1f2ca136548178e358873f7462bd79149c50f"
    },
    {
      "byte_length": 367,
      "media_type": "application/json",
      "path": "settlement/report.json",
      "sha256": "sha256:45ec69067286eac54e5f5779b86c0d47f2a6990aa962ac01f9427bee316ac03b"
    },
    {
      "byte_length": 1159,
      "media_type": "application/json",
      "path": "terms/term-document.json",
      "sha256": "sha256:096dd4111b0d94c46b4116542486a96b5d424e6d63bfaf72c373c710dbad50b3"
    },
    {
      "byte_length": 974,
      "media_type": "application/json",
      "path": "witness/decision-checkpoint.json",
      "sha256": "sha256:9c0c6096ab8fae3eeeb34d345bd7bcfc0d1c734061022b5417d89a15cfc878a5"
    },
    {
      "byte_length": 3297,
      "media_type": "application/json",
      "path": "witness/decision-inclusions.json",
      "sha256": "sha256:772bae7b913e38614197bfaea36f1c48ec62b720233727db4a96485b8c3423e2"
    },
    {
      "byte_length": 1043,
      "media_type": "application/json",
      "path": "witness/final-checkpoint.json",
      "sha256": "sha256:b22babcae160011cff3806e6a0844a10cf7190b2e32f5596c40e756d01fc5fd8"
    },
    {
      "byte_length": 3954,
      "media_type": "application/json",
      "path": "witness/final-inclusions.json",
      "sha256": "sha256:8032e50df71882b9f8978a3d0e7a5e61839a73306160f7750729b8bf74755f9a"
    }
  ],
  "comparison_group": "sha256:5ce5a6921e010535e3f7cf09998b0b11b299ee5d91e53400168500ee6d2075e9",
  "ordered_receipts": [
    {
      "action_type": "inference.order",
      "attestation": "sha256:8d2ad7bc0a20b4fddda5e8547a2e30cb60cff74f1664c74e50e3ca3afb987b48",
      "event": "sha256:e5919d742622f6c85e7415369a6adb17cfe6a55c0733c7441f38ee6934a0e88a",
      "path": "receipts/01-order.json",
      "role": "buyer"
    },
    {
      "action_type": "inference.route",
      "attestation": "sha256:5cd039ec0da60e2c2407f03d35c9f5321591437167cfaabf5330c1571fda5596",
      "event": "sha256:955f75f350bb24e78db0391e0f7ac7b285382019efdfd083f0b7c57e3d8211ed",
      "path": "receipts/02-route.json",
      "role": "router"
    },
    {
      "action_type": "inference.accept",
      "attestation": "sha256:9af0f7c455e1aee582543aecf5eda13824fbb92f3076bb2b6d47db6b1a71fa13",
      "event": "sha256:78f6d69fc85b99acefcd50095f19110837e338c5ca98bae9b9871a623b3cac8f",
      "path": "receipts/03-accept.json",
      "role": "provider"
    },
    {
      "action_type": "inference.delivery",
      "attestation": "sha256:f814bb144112dddc65aa4bb6250ffd2db30a2640041e5353c864bbb61bbc27c7",
      "event": "sha256:f03ea11330c06902cebee5b0d89c828b595b6432d4ba4b2808b301b177e4d396",
      "path": "receipts/04-delivery.json",
      "role": "receiver"
    },
    {
      "action_type": "assurance.collateral.bind",
      "attestation": "sha256:d5581a1472b410177691e626135716a1ac4031f46a718315135a897ef69b8e33",
      "event": "sha256:30c7ee4e865fdbde87ad03a6e660f668ab764e52d011c9d0f1ddbbbae5d5dc66",
      "path": "receipts/05-capital-bind.json",
      "role": "rail_observer"
    },
    {
      "action_type": "inference.coverage.checkpoint",
      "attestation": "sha256:7bfdd391998b9983548ea99d959122d240370a844382e7759cceedde3d07490a",
      "event": "sha256:116a600dad01c24cc932735e0c0c8e344ad13a88e3f3d9cc7167764c93b9562a",
      "path": "receipts/06-coverage-checkpoint.json",
      "role": "receiver"
    },
    {
      "action_type": "bulla.rely",
      "attestation": "sha256:a7f97c387fe4895eaa331a5ca9a54f1a1f7d572c9827c698af516f0fe7ac2a3e",
      "event": "sha256:c23fb981a353d0d83ca067b308570e56d3e29a9fc988a4715d5838a48b0ff75d",
      "path": "receipts/07-rely.json",
      "role": "relier"
    }
  ],
  "profile": "bulla.inference-clearing/0.1-experimental",
  "provider_kind": "REPRODUCIBLE",
  "revision": 1,
  "role_issuers": {
    "buyer": "did:key:z6Mkn88doHo3kuYVR2bWYpyN9pchLcv84zmQXqvMwQER4n7A",
    "guarantor": "did:key:z6MkwSA9zFts3AiU2eh7yYkZRdhj2Sc7hFsBu1PoTtW1KaiE",
    "provider_opaque": "did:key:z6MkpSp7vFWdLmeRZo387Yrx8oN99BZZsMsTHt2m4ts9W8K6",
    "provider_reproducible": "did:key:z6Mkit1vRUZTdAJPHmZWgLQJaH9GKpSW9Hq9vK3H15kdxwPZ",
    "publisher": "did:key:z6Mkopo6bkx95aEH1hJAfn7VL2V3jSEzspUFQ1Q1AyLCVihT",
    "rail_observer": "did:key:z6Mkt3WhcTGbye1XeXB2SqAcqtKPAM7XMFqyA5PKvCm2FCUs",
    "receiver": "did:key:z6MkfXgBCMUWz9sn3rmExpXgVsKaESNjE8DGwpDfhKfXAJzH",
    "relier": "did:key:z6MkimyBSNofYPyvMjmdWRNzMSsruqqcFuMN9p1kwhhrE1hr",
    "router": "did:key:z6MkwYBWPba3ZWZ7rGhiyN71VjH27kQGsHhqHeK2ErSvJ2Qn",
    "settlement_authority": "did:key:z6Mkksmuc11jNHwQzX5Bnhi9vbZBvUA9jjkAGbDWmvwGcqGo",
    "witness": "did:key:z6Mkt7ugjK7pupimB2noBDxFeHYn8EwCvGqrzXBp4nV6M4GW"
  },
  "term_root": "sha256:7adf4c4ba8d7aaa032e34ad942a9e5f1721da1fe5a4580783e29645ab1f52e9c",
  "transaction_id": "inference-bypass-001"
}
